<?xml version="1.0" encoding="iso-8859-1"?>
<!DOCTYPE manpage SYSTEM "manpage.dtd"
		[
				<!ENTITY site SYSTEM "WebTestSite.xml">
				]
		>

<manpage siteid="Build Overview">

	&site;

	<head title="Build Overview">
		<b>This section contains all reports generated during the last succesfull build of WebTest.</b>
	</head>

	<section title="Contents">
		<dl>
			<li>
				<dt>
					<pageref name="Change Log"/>
				</dt>
				<dd>Keeping track of the changes on a semantical level.
					This page should enable the user to take an informed decision whether updating
					to a new build is profitable.
				</dd>
			</li>
			<li>
				<dt>
					<pageref name="Unit Test Report"/>
				</dt>
				<dd>Shows the results of running the unit tests.
				</dd>
			</li>
			<li>
				<dt>
					<pageref name="Self Test Report"/>
				</dt>
				<dt>
					<pageref name="Release Test Report"/>
				</dt>
				<dd>Shows the results of the latest functional selftest.
					<n/>
					Every time Canoo WebTest is rebuilt, the selftests are triggered. Selftest
					means that Canoo WebTest is used to test itself.
					<n/>
					Like all the Canoo WebTests the selftest creates an
					<key>XML</key>
					report. The
					<pageref name="Self Test Report"/>
					is one example on how this report can
					be visualized via
					<key>XSLT</key>
					. The user can adapt this to personal or
					corporate preferences.
				</dd>
			</li>
			<li>
				<dt>
					<pageref name="API Doc"/>
				</dt>
				<dd>Shows the Application Programmer's Interface as generated by javadoc.
				</dd>
			</li>
			<li>
				<dt>
					<pageref name="Test Coverage"/>
				</dt>
				<dd>Displays the Canoo WebTest
					<pageref name="Test Coverage"/>
					produced with
					<key>CLOVER</key>
					.
					<n/>
					This coverage is both, the unit test coverage and the coverage achieved
					by running the selftest suite as in the
					<pageref name="Self Test Report"/>
					.
				</dd>
			</li>
			<li>
				<dt>
					<pageref name="History"/>
				</dt>
				<dd>Displays the
					<pageref name="History"/>
					of Canoo WebTest
					<pageref name="Test Coverage"/>
					and other project statistics. It is produced with
					<key>CLOVER</key>
					.
					<n/>
					The
					<pageref name="History"/>
					starts in July 2003.
				</dd>
			</li>
		</dl>
	</section>

</manpage>